Why Has Nobody Told Me This Before?: An International Bestselling Guide to Mental Health and Emotional Resilience from a Clinical Psychologist,Julie Smith,nonfiction,"psychology, narrative nonfiction",4.3,368,2022,2022/09/13,"Maybe You Should Talk to Someone, Educated, Lori Gottlieb","Narrative nonfiction — reads like a novel about psychology. If you like Lori Gottlieb, this hits the same notes.",May feel more informational than narrative if you prefer story-driven reads.,
Cheap Land Colorado: Off-Gridders at America's Edge,Ted Conover,nonfiction,"narrative nonfiction, adventure, social commentary",3.8,287,2022,2022/09/08,"Chesapeake Requiem, Educated, Earl Swift","Narrative nonfiction — reads like a novel about adventure. If you like Earl Swift, this hits the same notes.",Modest rating (3.8/5).,
Boys Will Be Boys: The Glory Days and Party Nights of the Dallas Cowboys Dynasty,Jeff Pearlman,nonfiction,"sports, narrative nonfiction, history",4,406,2008,2022/09/04,"Three-Ring Circus, Blood in the Garden, Jack McCallum","Narrative nonfiction — reads like a novel about sports. If you like Jack McCallum, this hits the same notes.",May feel more informational than narrative if you prefer story-driven reads.,
Sweetness: The Enigmatic Life of Walter Payton,Jeff Pearlman,nonfiction,"sports, biography, narrative nonfiction",4.2,496,2011,2022/09/04,"Tiger Woods, The Last Folk Hero, Jeff Benedict","In-depth biography. If you like Jeff Benedict, this hits the same notes.",May feel more informational than narrative if you prefer story-driven reads.,
The Paris Apartment,Lucy Foley,fiction,"thriller, mystery, suspense",3.7,360,2022,2022/06/21,"The Guest List, The Silent Patient, Alex Michaelides","Atmospheric thriller. If you like Alex Michaelides, this hits the same notes.",Modest rating (3.7/5).,
The Girl in the Castle,James Patterson,fiction,"thriller, historical, mystery",3.9,368,2022,2022/06/15,"Along Came a Spider, The Silent Patient, John Grisham","Fast-paced thriller. If you like John Grisham, this hits the same notes.",No obvious red flags — depends on your mood.,
Ghost Lover,Lisa Taddeo,fiction,"literary, contemporary",3.5,225,2022,2022/06/15,"Three Women, Tomorrow, and Tomorrow, and Tomorrow, Gabrielle Zevin","Rich character work and atmospheric prose. If you like Gabrielle Zevin, this hits the same notes.",Below-average community rating (3.5/5) — may underdeliver. Slow-burn pacing — not a fast thriller.,
Riding the Lightning: A Year in the Life of a New York City Paramedic,Anthony Almojera,nonfiction,"memoir, narrative nonfiction",4,243,2022,2022/05/31,"When Breath Becomes Air, This is Going to Hurt, Paul Kalanithi","Personal, candid memoir. If you like Paul Kalanithi, this hits the same notes.",May feel more informational than narrative if you prefer story-driven reads.,
The Latecomer,Jean Hanff Korelitz,fiction,"literary, historical, contemporary",3.7,439,2022,2022/05/19,"The Plot, Tomorrow, and Tomorrow, and Tomorrow, Gabrielle Zevin","Rich character work and atmospheric prose. If you like Gabrielle Zevin, this hits the same notes.",Modest rating (3.7/5). Slow-burn pacing — not a fast thriller.,
The Fiddler in the Subway: The Story of the World-Class Violinist Who Played for Handouts. . . And Other Virtuoso Performances by America's Foremost Feature Writer,Gene Weingarten,nonfiction,"narrative nonfiction, history",4,384,2010,2022/05/16,"One Day, I Wear the Black Hat, Chuck Klosterman","Narrative nonfiction — reads like a novel about history. If you like Chuck Klosterman, this hits the same notes.",May feel more informational than narrative if you prefer story-driven reads.,
A Visit from the Goon Squad,Jennifer Egan,fiction,"literary, contemporary",3.7,274,2010,2022/05/16,"Tomorrow, and Tomorrow, and Tomorrow, The Storied Life of A.J. Fikry, Gabrielle Zevin","Rich character work and atmospheric prose. If you like Gabrielle Zevin, this hits the same notes.",Modest rating (3.7/5). Slow-burn pacing — not a fast thriller.,
No One Is Talking About This,Patricia Lockwood,fiction,"literary, speculative, contemporary",3.4,210,2021,2022/05/16,"The Postmortal, Lake Success, Drew Magary","Inventive speculative premise. If you like Drew Magary, this hits the same notes.",Below-average community rating (3.4/5) — may underdeliver. Slow-burn pacing — not a fast thriller.,
"Gwendy's Final Task (The Button Box, #3)",Stephen King,fiction,"speculative, thriller, literary",4,288,2022,2022/05/16,"The Outsider, Elevation, Blake Crouch","Fast-paced thriller. If you like Blake Crouch, this hits the same notes.",Dark or heavy subject matter.,
The Infiltrator: My Secret Life Inside the Dirty Banks Behind Pablo Escobar's Medellín Cartel,Robert Mazur,nonfiction,"true crime, narrative nonfiction, investigative journalism",4.1,384,2009,2022/05/06,"American Kingpin, Dopesick, Nick Bilton","Narrative nonfiction — reads like a novel about true crime. If you like Nick Bilton, this hits the same notes.",Dark or heavy subject matter.,
How to Prevent the Next Pandemic,Bill Gates,nonfiction,"tech history, narrative nonfiction, history",3.8,304,2022,2022/04/28,"Source Code, The Code Breaker, Walter Isaacson","Narrative nonfiction — reads like a novel about tech history. If you like Walter Isaacson, this hits the same notes.",Modest rating (3.8/5).,
I'll Be Gone in the Dark: One Woman's Obsessive Search for the Golden State Killer,Michelle McNamara,nonfiction,"true crime, narrative nonfiction, investigative journalism",4.4,352,2018,2022/04/19,"American Kingpin, Dopesick, Nick Bilton","Narrative nonfiction — reads like a novel about true crime. If you like Nick Bilton, this hits the same notes.",Dark or heavy subject matter.,
Into the Water,Paula Hawkins,fiction,"thriller, psychological, mystery",3.5,392,2018,2022/04/19,"The Silent Patient, The Woman in the Window, B.A. Paris","Tense thriller. If you like B.A. Paris, this hits the same notes.",Below-average community rating (3.5/5) — may underdeliver. Dark or heavy subject matter.,
None of This Rocks: A Memoir,Joe Trohman,nonfiction,"memoir, narrative nonfiction",3.7,240,2022,2022/04/14,"The Storyteller, A Life in Parts, Dave Grohl","Personal, candid memoir. If you like Dave Grohl, this hits the same notes.",Modest rating (3.7/5).,
The Midrange Theory,Seth Partnow,nonfiction,"sports, narrative nonfiction",3.9,288,2021,2022/04/14,"How to Watch Basketball Like a Genius, The Extra 2%, Ben Cohen","Narrative nonfiction — reads like a novel about sports. If you like Ben Cohen, this hits the same notes.",May feel more informational than narrative if you prefer story-driven reads.,
Ten Letters: The American People in the Obama Years,Eli Saslow,nonfiction,"narrative nonfiction, history",3.9,304,2012,2022/03/26,"A Promised Land, One Day, Barack Obama","Narrative nonfiction — reads like a novel about history. If you like Barack Obama, this hits the same notes.",May feel more informational than narrative if you prefer story-driven reads.,
"A Criminal Justice (Philadelphia Legal, #4)",William L. Myers Jr.,fiction,"legal, thriller, courtroom",4.3,391,2020,2022/02/02,"A Time to Kill, Presumed Innocent, John Grisham","Fast-paced thriller. If you like John Grisham, this hits the same notes.",No obvious red flags — depends on your mood.,
"A Killer's Alibi (Philadelphia Legal, #3)",William L. Myers Jr.,fiction,"legal, thriller, courtroom",4.3,431,2019,2022/02/02,"A Time to Kill, Pleading Guilty, John Grisham","Fast-paced thriller. If you like John Grisham, this hits the same notes.",No obvious red flags — depends on your mood.,
"The Jury Master (David Sloane, #1)",Robert Dugoni,fiction,"legal, thriller, courtroom",4,449,2008,2022/02/02,"A Time to Kill, Presumed Innocent, John Grisham","Fast-paced thriller. If you like John Grisham, this hits the same notes.",No obvious red flags — depends on your mood.,
Built to Fail: The Inside Story of Blockbuster's Inevitable Bust,Alan Payne,nonfiction,"business, narrative nonfiction, tech history",4,270,2021,2022/01/26,"That Will Never Work, Super Pumped, Marc Randolph","Narrative nonfiction — reads like a novel about business. If you like Marc Randolph, this hits the same notes.",May feel more informational than narrative if you prefer story-driven reads.,
The Maidens,Alex Michaelides,fiction,"thriller, psychological, mystery",3.5,337,2021,2022/01/10,"The Silent Patient, Before I Go to Sleep, B.A. Paris","Fast-paced thriller. If you like B.A. Paris, this hits the same notes.",Below-average community rating (3.5/5) — may underdeliver. Dark or heavy subject matter.,
"Diablo Mesa (Nora Kelly, #3)",Douglas Preston,fiction,"thriller, mystery, suspense",4,385,2022,2022/01/03,"City of Endless Night, The Silent Patient, Alex Michaelides","Fast-paced thriller. If you like Alex Michaelides, this hits the same notes.",No obvious red flags — depends on your mood.,
Bittersweet: How Sorrow and Longing Make Us Whole,Susan Cain,nonfiction,"psychology, narrative nonfiction",3.6,310,2022,2021/12/28,"Maybe You Should Talk to Someone, Educated, Lori Gottlieb","Narrative nonfiction — reads like a novel about psychology. If you like Lori Gottlieb, this hits the same notes.",Below-average community rating (3.6/5) — may underdeliver.,
Comedy Comedy Comedy Drama,Bob Odenkirk,nonfiction,"memoir, humor, narrative nonfiction",3.8,284,2022,2021/12/28,"Yearbook, A Life in Parts, Seth Rogen","Personal, candid memoir. If you like Seth Rogen, this hits the same notes.",Modest rating (3.8/5).,
Everyday Millionaires,Chris Hogan,nonfiction,"finance, business, narrative nonfiction",4.3,272,2019,2021/12/25,"Shoe Dog, Flash Boys, Phil Knight","Narrative nonfiction — reads like a novel about finance. If you like Phil Knight, this hits the same notes.",May feel more informational than narrative if you prefer story-driven reads.,
Hard Cash Valley,Brian Panowich,fiction,"thriller, crime, mystery",4.1,320,2020,2021/12/23,"Blacktop Wasteland, Everybody Knows, S.A. Cosby","Fast-paced thriller. If you like S.A. Cosby, this hits the same notes.",Dark or heavy subject matter.,
Klara and the Sun,Kazuo Ishiguro,fiction,"literary, speculative, philosophical",3.9,303,2021,2021/12/09,"The Invisible Life of Addie LaRue, The Midnight Library, V.E. Schwab","Inventive speculative premise. If you like V.E. Schwab, this hits the same notes.","Slow-burn pacing — not a fast thriller. Dense, academic-leaning tone.",
Seek You: A Journey Through American Loneliness (Pantheon Graphic Library),Kristen Radtke,nonfiction,"narrative nonfiction, psychology",4,352,2021,2021/11/19,"Maybe You Should Talk to Someone, Educated, Lori Gottlieb","Narrative nonfiction — reads like a novel about psychology. If you like Lori Gottlieb, this hits the same notes.",May feel more informational than narrative if you prefer story-driven reads.,
"John Dies at the End (John Dies at the End, #1)",David Wong,fiction,"speculative, horror, humor",3.9,362,2007,2021/09/28,"World War Z, The Postmortal, Max Brooks","Inventive speculative premise. If you like Max Brooks, this hits the same notes.",Slow-burn pacing — not a fast thriller. Dark or heavy subject matter.,
Taste: My Life Through Food,Stanley Tucci,nonfiction,"memoir, narrative nonfiction",4,291,2021,2021/09/28,"Eat a Peach, Save Me the Plums, David Chang","Personal, candid memoir. If you like David Chang, this hits the same notes.",May feel more informational than narrative if you prefer story-driven reads.,
"Juror #3 (Ruby Bozarth, #1)",James Patterson,fiction,"legal, thriller, courtroom",3.8,352,2018,2021/09/20,"A Time to Kill, Along Came a Spider, John Grisham","Fast-paced thriller. If you like John Grisham, this hits the same notes.",Modest rating (3.8/5).,
Sunshine Girl: An Unexpected Life,Julianna Margulies,nonfiction,"memoir, narrative nonfiction",3.8,229,2021,2021/09/07,"A Life in Parts, Yearbook, Bryan Cranston","Personal, candid memoir. If you like Bryan Cranston, this hits the same notes.",Modest rating (3.8/5).,
Amusing Ourselves to Death: Public Discourse in the Age of Show Business,Neil Postman,nonfiction,"history, narrative nonfiction",4.2,184,2005,2021/08/30,"I Wear the Black Hat, Sex, Drugs, and Cocoa Puffs, Chuck Klosterman","Narrative nonfiction — reads like a novel about history. If you like Chuck Klosterman, this hits the same notes.",Short at 184 pages — may feel slight.,
The Wreckage of My Presence,Casey Wilson,nonfiction,"humor, memoir, narrative nonfiction",3.8,288,2021,2021/08/23,"Yearbook, A Life in Parts, Seth Rogen","Personal, candid memoir. If you like Seth Rogen, this hits the same notes.",Modest rating (3.8/5).,
"L.A. Son: My Life, My City, My Food",Roy Choi,nonfiction,"memoir, narrative nonfiction",3.9,352,2013,2021/08/23,"Eat a Peach, Yes, Chef, David Chang","Personal, candid memoir. If you like David Chang, this hits the same notes.",May feel more informational than narrative if you prefer story-driven reads.,
"Constance (Constance, #1)",Matthew FitzSimmons,fiction,"sci-fi, speculative, thriller",3.7,343,2021,2021/08/02,"Recursion, Dark Matter, Blake Crouch","Atmospheric thriller. If you like Blake Crouch, this hits the same notes.",Modest rating (3.7/5).,
"To Sleep in a Sea of Stars (Fractalverse, #1)",Christopher Paolini,fiction,"sci-fi, speculative, adventure",3.8,880,2021,2021/08/02,"Seveneves, Project Hail Mary, Neal Stephenson","Inventive speculative premise. If you like Neal Stephenson, this hits the same notes.",Modest rating (3.8/5). Long commitment at 880 pages.,
Termination Shock,Neal Stephenson,fiction,"sci-fi, speculative, literary",3.5,708,2021,2021/07/21,"Seveneves, Dark Matter, Blake Crouch","Inventive speculative premise. If you like Blake Crouch, this hits the same notes.",Below-average community rating (3.5/5) — may underdeliver. Slow-burn pacing — not a fast thriller.,
"If You Tell: A True Story of Murder, Family Secrets, and the Unbreakable Bond of Sisterhood",Gregg Olsen,nonfiction,"true crime, narrative nonfiction, investigative journalism",4.4,431,2019,2021/07/10,"American Kingpin, Dopesick, Nick Bilton","Narrative nonfiction — reads like a novel about true crime. If you like Nick Bilton, this hits the same notes.",Dark or heavy subject matter.,
Lizzie & Dante,Mary Bly,fiction,"romance, literary, historical",3.5,320,2021,2021/06/12,"One Day, The Statistical Probability of Love at First Sight, David Nicholls","Rich character work and atmospheric prose. If you like David Nicholls, this hits the same notes.",Below-average community rating (3.5/5) — may underdeliver. Slow-burn pacing — not a fast thriller.,
The Great Influenza: The Story of the Deadliest Pandemic in History,John M. Barry,nonfiction,"narrative nonfiction, history, military",4.2,546,2005,2021/06/04,"The First Shots, The Accidental President, A.J. Baime","Narrative nonfiction — reads like a novel about history. If you like A.J. Baime, this hits the same notes.",Long commitment at 546 pages.,
"Blood, Bones, and Butter: The Inadvertent Education of a Reluctant Chef",Gabrielle Hamilton,nonfiction,"memoir, food, narrative nonfiction",3.9,304,2011,2021/06/02,"Eat a Peach, Save Me the Plums, David Chang","Personal, candid memoir. If you like David Chang, this hits the same notes.",May feel more informational than narrative if you prefer story-driven reads.,
"Chasing the Thrill: Obsession, Death, and Glory in America's Most Extraordinary Treasure Hunt",Daniel Barbarisi,nonfiction,"narrative nonfiction, adventure, social commentary",4.1,368,2021,2021/04/02,"The Lost City of Z, The Art Thief, David Grann","Narrative nonfiction — reads like a novel about adventure. If you like David Grann, this hits the same notes.",May feel more informational than narrative if you prefer story-driven reads.,
The Humans,Matt Haig,fiction,"speculative, literary, philosophical",4,285,2013,2021/03/01,"The Midnight Library, The Invisible Life of Addie LaRue, V.E. Schwab","Inventive speculative premise. If you like V.E. Schwab, this hits the same notes.",Slow-burn pacing — not a fast thriller.,
Think Again: The Power of Knowing What You Don't Know,Adam M. Grant,nonfiction,"psychology, business, narrative nonfiction",4,307,2021,2021/02/06,"Maybe You Should Talk to Someone, Educated, Lori Gottlieb","Narrative nonfiction — reads like a novel about psychology. If you like Lori Gottlieb, this hits the same notes.",May feel more informational than narrative if you prefer story-driven reads.,
The Terroir of Whiskey: A Distiller's Journey Into the Flavor of Place (Arts and Traditions of the Table: Perspectives on Culinary History),Rob Arnold,nonfiction,"narrative nonfiction, food",3.8,356,2020,2020/12/24,"Pappyland, Beyond the Pale, Wright Thompson","Narrative nonfiction — reads like a novel about food. If you like Wright Thompson, this hits the same notes.",Modest rating (3.8/5).,
Alibaba: The House That Jack Ma Built,Duncan Clark,nonfiction,"tech history, business, narrative nonfiction",3.8,304,2016,2020/12/01,"The Everything Store, Super Pumped, Brad Stone","Narrative nonfiction — reads like a novel about tech history. If you like Brad Stone, this hits the same notes.",Modest rating (3.8/5).,
Built from Scratch: How a Couple of Regular Guys Grew The Home Depot from Nothing to $30 Billion,Bernie Marcus,nonfiction,"business, biography, narrative nonfiction",4.2,352,1999,2020/11/29,"Shoe Dog, That Will Never Work, Phil Knight","In-depth biography. If you like Phil Knight, this hits the same notes.",May feel more informational than narrative if you prefer story-driven reads.,
Pee Wees: Confessions of a Hockey Parent,Rich Cohen,nonfiction,"sports, humor, memoir",3.7,240,2021,2020/11/25,"Fantasyland, I Wear the Black Hat, Chuck Klosterman","Personal, candid memoir. If you like Chuck Klosterman, this hits the same notes.",Modest rating (3.7/5).,
The New One: Painfully True Stories from a Reluctant Dad,Mike Birbiglia,nonfiction,"humor, memoir, narrative nonfiction",4,256,2020,2020/11/20,"Yearbook, Someone Could Get Hurt, Seth Rogen","Personal, candid memoir. If you like Seth Rogen, this hits the same notes.",May feel more informational than narrative if you prefer story-driven reads.,
Talking to GOATs: The Moments You Remember and the Stories You Never Heard,Jim Gray,nonfiction,"sports, biography, narrative nonfiction",4,336,2020,2020/11/13,"Three-Ring Circus, Dream Team, Jeff Pearlman","In-depth biography. If you like Jeff Pearlman, this hits the same notes.",May feel more informational than narrative if you prefer story-driven reads.,
The Big Picture: The Fight for the Future of Movies,Ben Fritz,nonfiction,"business, narrative nonfiction, tech history",3.8,309,2018,2020/10/15,"Super Pumped, That Will Never Work, Mike Isaac","Narrative nonfiction — reads like a novel about business. If you like Mike Isaac, this hits the same notes.",Modest rating (3.8/5).,
Football For A Buck: The Crazy Rise and Crazier Demise of the USFL,Jeff Pearlman,nonfiction,"sports, narrative nonfiction, history",4.1,384,2018,2020/10/09,"Three-Ring Circus, The Last Folk Hero, Jack McCallum","Narrative nonfiction — reads like a novel about sports. If you like Jack McCallum, this hits the same notes.",May feel more informational than narrative if you prefer story-driven reads.,
Is This Anything?,Jerry Seinfeld,nonfiction,"humor, narrative nonfiction",4,480,2020,2020/09/30,"Sex, Drugs, and Cocoa Puffs, Yearbook, Chuck Klosterman","Narrative nonfiction — reads like a novel about humor. If you like Chuck Klosterman, this hits the same notes.",May feel more informational than narrative if you prefer story-driven reads.,
Bitter Brew: The Rise and Fall of Anheuser-Busch and America's Kings of Beer,William Knoedelseder,nonfiction,"business, history, narrative nonfiction",4.1,416,2012,2020/09/25,"Pappyland, Beyond the Pale, Wright Thompson","Narrative nonfiction — reads like a novel about business. If you like Wright Thompson, this hits the same notes.",May feel more informational than narrative if you prefer story-driven reads.,
God-Level Knowledge Darts: Life Lessons from the Bronx,Desus,nonfiction,"humor, memoir, narrative nonfiction",3.8,192,2020,2020/09/24,"Yearbook, I Wear the Black Hat, Seth Rogen","Personal, candid memoir. If you like Seth Rogen, this hits the same notes.",Modest rating (3.8/5). Short at 192 pages — may feel slight.,
George Lucas: A Life,Brian Jay Jones,nonfiction,"biography, narrative nonfiction, business",4,550,2016,2020/09/22,"Steve Jobs, Elon Musk, Walter Isaacson","In-depth biography. If you like Walter Isaacson, this hits the same notes.",Long commitment at 550 pages.,
Where Men Win Glory: The Odyssey of Pat Tillman,Jon Krakauer,nonfiction,"military, biography, narrative nonfiction",4.3,323,2009,2020/09/22,"The Arsenal of Democracy, Ghost Soldiers, A.J. Baime","In-depth biography. If you like A.J. Baime, this hits the same notes.",Dark or heavy subject matter.,
The Answer Is…: Reflections on My Life,Alex Trebek,nonfiction,"memoir, narrative nonfiction",4.1,304,2020,2020/09/15,"A Life in Parts, Yearbook, Bryan Cranston","Personal, candid memoir. If you like Bryan Cranston, this hits the same notes.",May feel more informational than narrative if you prefer story-driven reads.,
"The Enigma Cube (Alien Artifact, #1)",Douglas E. Richards,fiction,"sci-fi, speculative, thriller",4.3,424,2020,2020/09/03,"Project Hail Mary, Recursion, Andy Weir","Fast-paced thriller. If you like Andy Weir, this hits the same notes.",No obvious red flags — depends on your mood.,
What It Takes: Lessons in the Pursuit of Excellence,Stephen A. Schwarzman,nonfiction,"finance, business, biography",3.9,400,2019,2020/08/02,"Shoe Dog, The Everything Store, Phil Knight","In-depth biography. If you like Phil Knight, this hits the same notes.",Nonfiction with dense material — requires focus.,
Chuck Klosterman IV: A Decade of Curious People and Dangerous Ideas,Chuck Klosterman,nonfiction,"humor, narrative nonfiction",3.8,374,2006,2020/07/08,"Sex, Drugs, and Cocoa Puffs, I Wear the Black Hat, Jeff Pearlman","Narrative nonfiction — reads like a novel about humor. If you like Jeff Pearlman, this hits the same notes.",Modest rating (3.8/5).,
The Visible Man,Chuck Klosterman,fiction,"literary, speculative, psychological",3.4,230,2011,2020/07/08,"Raised in Captivity, The Postmortal, Drew Magary","Psychological. If you like Drew Magary, this hits the same notes.",Below-average community rating (3.4/5) — may underdeliver. Slow-burn pacing — not a fast thriller.,
Downtown Owl,Chuck Klosterman,fiction,"literary, contemporary",3.6,275,2008,2020/07/08,"Little Children, Tracy Flick Can't Win, Tom Perrotta","Rich character work and atmospheric prose. If you like Tom Perrotta, this hits the same notes.",Below-average community rating (3.6/5) — may underdeliver. Character-driven literary fiction — light on plot momentum.,
Fargo Rock City: A Heavy Metal Odyssey in Rural North Dakota,Chuck Klosterman,nonfiction,"memoir, humor, narrative nonfiction",3.8,320,2003,2020/07/08,"Sex, Drugs, and Cocoa Puffs, Killing Yourself to Live, Jeff Pearlman","Personal, candid memoir. If you like Jeff Pearlman, this hits the same notes.",Modest rating (3.8/5).,
Amity and Prosperity: One Family and the Fracturing of America,Eliza Griswold,nonfiction,"narrative nonfiction, history",4,318,2018,2020/06/18,"Evicted, Paradise, Matthew Desmond","Narrative nonfiction — reads like a novel about history. If you like Matthew Desmond, this hits the same notes.",May feel more informational than narrative if you prefer story-driven reads.,
Hidden Valley Road: Inside the Mind of an American Family,Robert Kolker,nonfiction,"narrative nonfiction, psychology, history",4.3,377,2020,2020/06/18,"Maybe You Should Talk to Someone, Dopesick, Lori Gottlieb","Narrative nonfiction — reads like a novel about psychology. If you like Lori Gottlieb, this hits the same notes.",May feel more informational than narrative if you prefer story-driven reads.,
Player Piano,Kurt Vonnegut Jr.,fiction,"speculative, literary, dystopia",3.9,341,2006,2020/06/11,"The Postmortal, World War Z, Drew Magary","Inventive speculative premise. If you like Drew Magary, this hits the same notes.",Slow-burn pacing — not a fast thriller. Character-driven literary fiction — light on plot momentum.,
The Last Trial (Kindle County Legal Thriller #11),Scott Turow,fiction,"legal, thriller, courtroom",4,464,2020,2020/05/27,"Presumed Innocent, Pleading Guilty, John Grisham","Tense thriller. If you like John Grisham, this hits the same notes.",No obvious red flags — depends on your mood.,
"Annihilation (Southern Reach, #1)",Jeff Vandermeer,fiction,"speculative, literary, mystery",3.7,195,2014,2020/05/21,"Seveneves, Dark Matter, Blake Crouch","Atmospheric mystery. If you like Blake Crouch, this hits the same notes.",Modest rating (3.7/5). Slow-burn pacing — not a fast thriller.,
