How to Know a Person: The Art of Seeing Others Deeply and Being Deeply Seen,David Brooks,nonfiction,"psychology, narrative nonfiction",3.9,306,2023,2024/05/25,"Maybe You Should Talk to Someone, Educated, Lori Gottlieb","Narrative nonfiction — reads like a novel about psychology. If you like Lori Gottlieb, this hits the same notes.",May feel more informational than narrative if you prefer story-driven reads.,
Seeing Further: The Story of Science and the Royal Society,Bill Bryson,nonfiction,"science, history, narrative nonfiction",3.7,413,2010,2024/05/25,"The Code Breaker, The Innovators, Walter Isaacson","Narrative nonfiction — reads like a novel about science. If you like Walter Isaacson, this hits the same notes.",Modest rating (3.7/5).,
"Return of the King: LeBron James, The Cleveland Cavaliers and the Greatest Comeback in NBA History",Brian Windhorst,nonfiction,"sports, narrative nonfiction, biography",4.1,288,2017,2024/05/20,"Three-Ring Circus, Giannis, Jeff Pearlman","In-depth biography. If you like Jeff Pearlman, this hits the same notes.",May feel more informational than narrative if you prefer story-driven reads.,
The Wright Brothers,David McCullough,nonfiction,"history, biography, narrative nonfiction",4.1,320,2015,2024/05/09,"The Arsenal of Democracy, The Accidental President, A.J. Baime","In-depth biography. If you like A.J. Baime, this hits the same notes.",May feel more informational than narrative if you prefer story-driven reads.,
Fire Weather: A True Story from a Hotter World,John Vaillant,nonfiction,"narrative nonfiction, history, adventure",4.2,432,2023,2024/05/08,"Paradise, Into Thin Air, Lizzie Johnson","Narrative nonfiction — reads like a novel about history. If you like Lizzie Johnson, this hits the same notes.",May feel more informational than narrative if you prefer story-driven reads.,
"The Best Minds: A Story of Friendship, Madness, and the Tragedy of Good Intentions",Jonathan Rosen,nonfiction,"narrative nonfiction, psychology, history",4.1,576,2023,2024/05/08,"Maybe You Should Talk to Someone, Dopesick, Lori Gottlieb","Narrative nonfiction — reads like a novel about psychology. If you like Lori Gottlieb, this hits the same notes.",Long commitment at 576 pages.,
The Last of His Kind: Clayton Kershaw and the Burden of Greatness,Andy McCullough,nonfiction,"sports, biography, narrative nonfiction",4.1,400,2024,2024/05/05,"Doc, Charlie Hustle, Todd Zolecki","In-depth biography. If you like Todd Zolecki, this hits the same notes.",May feel more informational than narrative if you prefer story-driven reads.,
Challenger: A True Story of Heroism and Disaster on the Edge of Space,Adam Higginbotham,nonfiction,"narrative nonfiction, history, adventure",4.3,563,2024,2024/05/01,"When the Heavens Went on Sale, Into Thin Air, Ashlee Vance","Narrative nonfiction — reads like a novel about history. If you like Ashlee Vance, this hits the same notes.",Long commitment at 563 pages.,
The Mother Tongue: English and How It Got That Way,Bill Bryson,nonfiction,"humor, history, narrative nonfiction",3.9,270,1991,2024/04/26,"Sex, Drugs, and Cocoa Puffs, I Wear the Black Hat, Chuck Klosterman","Narrative nonfiction — reads like a novel about humor. If you like Chuck Klosterman, this hits the same notes.",May feel more informational than narrative if you prefer story-driven reads.,
The Trolls of Wall Street: How the Outcasts and Insurgents Are Hacking the Markets,Nathaniel Popper,nonfiction,"finance, wall street, narrative nonfiction",3.9,352,2024,2024/04/18,"The Dumb Money, Flash Boys, Ben Mezrich","Narrative nonfiction — reads like a novel about finance. If you like Ben Mezrich, this hits the same notes.",Dark or heavy subject matter.,
Revival,Stephen King,fiction,"thriller, horror, literary",3.8,405,2014,2024/04/13,"The Outsider, The Stand, Blake Crouch","Atmospheric thriller. If you like Blake Crouch, this hits the same notes.",Modest rating (3.8/5). Dark or heavy subject matter.,
Refund: Stories,Karen E. Bender,fiction,"literary, contemporary",3.5,256,2015,2024/04/13,"The Invisible Life of Addie LaRue, Tomorrow, and Tomorrow, and Tomorrow, V.E. Schwab","Rich character work and atmospheric prose. If you like V.E. Schwab, this hits the same notes.",Below-average community rating (3.5/5) — may underdeliver. Slow-burn pacing — not a fast thriller.,
"Hello, Goodbye, and Everything in Between",Jennifer E. Smith,fiction,"romance, coming-of-age, literary",3.9,246,2015,2024/04/05,"The Statistical Probability of Love at First Sight, Every Day, David Levithan","Rich character work and atmospheric prose. If you like David Levithan, this hits the same notes.",Slow-burn pacing — not a fast thriller. Character-driven literary fiction — light on plot momentum.,
If You Can't Take the Heat,Michael Ruhlman,nonfiction,"memoir, narrative nonfiction",3.9,320,2024,2024/03/24,"Eat a Peach, Yes, Chef, David Chang","Personal, candid memoir. If you like David Chang, this hits the same notes.",May feel more informational than narrative if you prefer story-driven reads.,
On Earth as It Is on Television,Emily Jane,fiction,"speculative, literary, humor",3.5,380,2024,2024/03/24,"The Postmortal, World War Z, Drew Magary","Inventive speculative premise. If you like Drew Magary, this hits the same notes.",Below-average community rating (3.5/5) — may underdeliver. Slow-burn pacing — not a fast thriller.,
Flying Blind: The 737 MAX Tragedy and the Fall of Boeing,Peter Robison,nonfiction,"narrative nonfiction, business, tech history",4.2,336,2021,2024/03/18,"Super Pumped, The Big Short, Mike Isaac","Narrative nonfiction — reads like a novel about business. If you like Mike Isaac, this hits the same notes.",Dark or heavy subject matter.,
Influence Empire: The Story of Tencent and China's Tech Ambition,Lulu Yilun Chen,nonfiction,"tech history, business, narrative nonfiction",3.7,320,2022,2024/02/22,"Super Pumped, The Everything Store, Mike Isaac","Narrative nonfiction — reads like a novel about tech history. If you like Mike Isaac, this hits the same notes.",Modest rating (3.7/5).,
The Power Law: Venture Capital and the Making of the New Future,Sebastian Mallaby,nonfiction,"finance, tech history, narrative nonfiction",3.9,496,2022,2024/02/22,"The Man Who Solved the Market, Flash Boys, Michael Lewis","Narrative nonfiction — reads like a novel about finance. If you like Michael Lewis, this hits the same notes.",May feel more informational than narrative if you prefer story-driven reads.,
Yellowface,R.F. Kuang,fiction,"thriller, literary, psychological",4,319,2023,2023/12/10,"The Plot, Verity, Jean Hanff Korelitz","Tense thriller. If you like Jean Hanff Korelitz, this hits the same notes.",Less plot-driven than typical genre fiction.,
The Wise Men: Six Friends and the World They Made,Walter Isaacson,nonfiction,"history, biography, narrative nonfiction",4.2,864,1997,2023/11/20,"Steve Jobs, The Accidental President, A.J. Baime","In-depth biography. If you like A.J. Baime, this hits the same notes.",Long commitment at 864 pages.,
Kissinger: A Biography,Walter Isaacson,nonfiction,"biography, history, narrative nonfiction",4.1,896,2005,2023/11/20,"Steve Jobs, Elon Musk, A.J. Baime","In-depth biography. If you like A.J. Baime, this hits the same notes.",Long commitment at 896 pages.,
Survival of the Thickest: Essays,Michelle Buteau,nonfiction,"humor, memoir, narrative nonfiction",3.8,289,2022,2023/11/20,"Yearbook, A Life in Parts, Seth Rogen","Personal, candid memoir. If you like Seth Rogen, this hits the same notes.",Modest rating (3.8/5).,
Skippy Dies,Paul Murray,fiction,"literary, coming-of-age",3.9,661,2010,2023/11/18,"Looking for Alaska, Paper Towns, John Green","Rich character work and atmospheric prose. If you like John Green, this hits the same notes.",Slow-burn pacing — not a fast thriller. Character-driven literary fiction — light on plot momentum.,
Made for Love,Alissa Nutting,fiction,"speculative, literary, humor",3.5,307,2017,2023/11/18,"The Postmortal, The Rosie Project, Drew Magary","Inventive speculative premise. If you like Drew Magary, this hits the same notes.",Below-average community rating (3.5/5) — may underdeliver. Slow-burn pacing — not a fast thriller.,
The Sellout,Paul Beatty,fiction,"literary, humor, contemporary",3.6,289,2015,2023/11/18,"Raised in Captivity, Lake Success, Chuck Klosterman","Rich character work and atmospheric prose. If you like Chuck Klosterman, this hits the same notes.",Below-average community rating (3.6/5) — may underdeliver. Slow-burn pacing — not a fast thriller.,
Black Sheep,Rachel Harrison,fiction,"thriller, horror, speculative",3.6,289,2023,2023/11/18,"The Outsider, The Stand, Stephen King","Atmospheric thriller. If you like Stephen King, this hits the same notes.",Below-average community rating (3.6/5) — may underdeliver. Dark or heavy subject matter.,
"Still Me (Me Before You, #3)",Jojo Moyes,fiction,"romance, literary, contemporary",3.9,368,2018,2023/11/14,"One Day, The Statistical Probability of Love at First Sight, David Nicholls","Rich character work and atmospheric prose. If you like David Nicholls, this hits the same notes.",Slow-burn pacing — not a fast thriller. Character-driven literary fiction — light on plot momentum.,
Sleeping Beauties,Stephen King,fiction,"thriller, horror, speculative",3.8,702,2017,2023/11/14,"The Stand, The Outsider, Blake Crouch","Atmospheric thriller. If you like Blake Crouch, this hits the same notes.",Modest rating (3.8/5). Dark or heavy subject matter.,
Truly Madly Guilty,Liane Moriarty,fiction,"thriller, literary, psychological",3.8,432,2016,2023/11/14,"Behind Closed Doors, Remarkably Bright Creatures, B.A. Paris","Tense thriller. If you like B.A. Paris, this hits the same notes.",Modest rating (3.8/5).,
Mean Baby: A Memoir of Growing Up,Selma Blair,nonfiction,"memoir, narrative nonfiction",3.9,320,2022,2023/11/14,"When Breath Becomes Air, A Life in Parts, Paul Kalanithi","Personal, candid memoir. If you like Paul Kalanithi, this hits the same notes.",May feel more informational than narrative if you prefer story-driven reads.,
Entrances and Exits,Michael Richards,nonfiction,"memoir, humor, narrative nonfiction",3.7,425,2024,2023/11/08,"Yearbook, A Life in Parts, Seth Rogen","Personal, candid memoir. If you like Seth Rogen, this hits the same notes.",Modest rating (3.7/5).,
The Dilemma,B.A. Paris,fiction,"thriller, psychological, suspense",3.7,342,2020,2023/11/04,"Behind Closed Doors, The Breakdown, Shari Lapena","Fast-paced thriller. If you like Shari Lapena, this hits the same notes.",Modest rating (3.7/5). Dark or heavy subject matter.,
The Therapist,B.A. Paris,fiction,"thriller, psychological, suspense",3.6,298,2021,2023/11/04,"Behind Closed Doors, The Breakdown, Shari Lapena","Fast-paced thriller. If you like Shari Lapena, this hits the same notes.",Below-average community rating (3.6/5) — may underdeliver. Dark or heavy subject matter.,
Bring Me Back,B.A. Paris,fiction,"thriller, psychological, suspense",3.4,291,2018,2023/11/04,"Behind Closed Doors, Before I Go to Sleep, Shari Lapena","Fast-paced thriller. If you like Shari Lapena, this hits the same notes.",Below-average community rating (3.4/5) — may underdeliver. Dark or heavy subject matter.,
Born Standing Up: A Comic's Life,Steve Martin,nonfiction,"memoir, humor, biography",4.1,207,2007,2023/10/21,"Yearbook, A Life in Parts, Seth Rogen","Personal, candid memoir. If you like Seth Rogen, this hits the same notes.",May feel more informational than narrative if you prefer story-driven reads.,
"Everybody Lies: Big Data, New Data, and What the Internet Can Tell Us About Who We Really Are",Seth Stephens-Davidowitz,nonfiction,"narrative nonfiction, psychology, tech history",4,338,2017,2023/10/21,"The Hot Hand, Flash Boys, Ben Cohen","Narrative nonfiction — reads like a novel about psychology. If you like Ben Cohen, this hits the same notes.",May feel more informational than narrative if you prefer story-driven reads.,
Get the Picture: A Mind-Bending Journey Among the Inspired Artists and Obsessive Art Fiends Who Taught Me How to See,Bianca Bosker,nonfiction,"narrative nonfiction, business",4.1,370,2024,2023/10/05,"The Art Thief, Educated, Michael Finkel","Narrative nonfiction — reads like a novel about business. If you like Michael Finkel, this hits the same notes.",May feel more informational than narrative if you prefer story-driven reads.,
So Fetch: The Making of Mean Girls (and Why We Are Still So Obsessed with It),Jennifer Keishin Armstrong,nonfiction,"narrative nonfiction, humor",4,272,2024,2023/10/05,"I Wear the Black Hat, Yearbook, Chuck Klosterman","Narrative nonfiction — reads like a novel about humor. If you like Chuck Klosterman, this hits the same notes.",May feel more informational than narrative if you prefer story-driven reads.,
Come and Get It,Kiley Reid,fiction,"literary, contemporary",3.5,400,2024,2023/10/05,"Lake Success, Tomorrow, and Tomorrow, and Tomorrow, Gary Shteyngart","Rich character work and atmospheric prose. If you like Gary Shteyngart, this hits the same notes.",Below-average community rating (3.5/5) — may underdeliver. Slow-burn pacing — not a fast thriller.,
The Mist,Stephen King,fiction,"thriller, horror, speculative",4.1,176,2007,2023/09/29,"The Stand, The Outsider, Blake Crouch","Atmospheric thriller. If you like Blake Crouch, this hits the same notes.",Dark or heavy subject matter. Short at 176 pages — may feel slight.,
Going Zero,Anthony McCarten,fiction,"thriller, speculative, high-concept",3.7,304,2023,2023/09/23,"Recursion, Dark Matter, Blake Crouch","Fast-paced thriller. If you like Blake Crouch, this hits the same notes.",Modest rating (3.7/5).,
The Rocket That Fell to Earth: Roger Clemens and the Rage for Baseball Immortality,Jeff Pearlman,nonfiction,"sports, biography, narrative nonfiction",4,348,2009,2023/09/16,"Doc, Charlie Hustle, Todd Zolecki","In-depth biography. If you like Todd Zolecki, this hits the same notes.",May feel more informational than narrative if you prefer story-driven reads.,
The Fury,Alex Michaelides,fiction,"thriller, psychological, mystery",3.8,298,2024,2023/09/12,"The Silent Patient, Before I Go to Sleep, B.A. Paris","Fast-paced thriller. If you like B.A. Paris, this hits the same notes.",Modest rating (3.8/5). Dark or heavy subject matter.,
Have I Told You This Already?: Stories I Don't Want to Forget to Remember,Lauren Graham,nonfiction,"humor, memoir, narrative nonfiction",3.5,208,2023,2023/09/07,"Yearbook, A Life in Parts, Seth Rogen","Personal, candid memoir. If you like Seth Rogen, this hits the same notes.",Below-average community rating (3.5/5) — may underdeliver.,
Trust,Hernan Diaz,fiction,"literary, historical",3.8,402,2022,2023/08/31,"Tomorrow, and Tomorrow, and Tomorrow, The Invisible Life of Addie LaRue, Gabrielle Zevin","Rich character work and atmospheric prose. If you like Gabrielle Zevin, this hits the same notes.",Modest rating (3.8/5). Slow-burn pacing — not a fast thriller.,
Twas the Nightshift Before Christmas,Adam Kay,nonfiction,"humor, memoir, narrative nonfiction",4.3,144,2019,2023/08/27,"This is Going to Hurt, Yearbook, Seth Rogen","Personal, candid memoir. If you like Seth Rogen, this hits the same notes.",Short at 144 pages — may feel slight.,
Cleo McDougal Regrets Nothing,Allison Winn Scotch,fiction,"literary, contemporary",3.8,328,2020,2023/08/26,"Romantic Comedy, One Day, Curtis Sittenfeld","Rich character work and atmospheric prose. If you like Curtis Sittenfeld, this hits the same notes.",Modest rating (3.8/5).,
Gambler: Secrets from a Life at Risk,Billy Walters,nonfiction,"memoir, narrative nonfiction",4.1,384,2023,2023/08/21,"Molly's Game, Ship It Holla Ballas!, Ben Mezrich","Personal, candid memoir. If you like Ben Mezrich, this hits the same notes.",Dark or heavy subject matter.,
The Husband's Secret,Liane Moriarty,fiction,"thriller, literary, psychological",3.9,396,2013,2023/08/20,"Behind Closed Doors, The Breakdown, B.A. Paris","Tense thriller. If you like B.A. Paris, this hits the same notes.",Less plot-driven than typical genre fiction.,
"Power Play: Tesla, Elon Musk, and the Bet of the Century",Tim Higgins,nonfiction,"tech history, biography, narrative nonfiction",3.9,400,2021,2023/08/17,"Elon Musk, Elon Musk, Ashlee Vance","In-depth biography. If you like Ashlee Vance, this hits the same notes.",May feel more informational than narrative if you prefer story-driven reads.,
Mr. Mercedes (Bill Hodges #1),Stephen King,fiction,"thriller, mystery",4,437,2014,2023/08/17,"The Outsider, Billy Summers, Blake Crouch","Atmospheric thriller. If you like Blake Crouch, this hits the same notes.",Dark or heavy subject matter.,
The Liars' Club,Mary Karr,nonfiction,"memoir, literary, narrative nonfiction",4,352,2005,2023/07/16,"Educated, The Glass Castle, Tara Westover","Personal, candid memoir. If you like Tara Westover, this hits the same notes.",Slow-burn pacing.,
"For Blood and Money: Billionaires, Biotech, and the Quest for a Blockbuster Drug",Nathan Vardi,nonfiction,"finance, narrative nonfiction, business",3.9,288,2023,2023/07/01,"Flash Boys, The Big Short, Michael Lewis","Narrative nonfiction — reads like a novel about finance. If you like Michael Lewis, this hits the same notes.",May feel more informational than narrative if you prefer story-driven reads.,
"Class: A Memoir of Motherhood, Hunger, and Higher Education",Stephanie Land,nonfiction,"memoir, narrative nonfiction",3.9,288,2023,2023/07/01,"Maid, Educated, Tara Westover","Personal, candid memoir. If you like Tara Westover, this hits the same notes.",May feel more informational than narrative if you prefer story-driven reads.,
Cassandra in Reverse,Holly Smale,fiction,"speculative, romance, literary",3.8,362,2023,2023/06/28,"The Measure, The Invisible Life of Addie LaRue, Nikki Erlick","Inventive speculative premise. If you like Nikki Erlick, this hits the same notes.",Modest rating (3.8/5). Slow-burn pacing — not a fast thriller.,
Mr. Texas,Lawrence Wright,fiction,"literary, political, contemporary",3.7,323,2023,2023/06/17,"The Plot, Lake Success, Jean Hanff Korelitz","Rich character work and atmospheric prose. If you like Jean Hanff Korelitz, this hits the same notes.",Modest rating (3.7/5). Slow-burn pacing — not a fast thriller.,
"The Cold Cold Ground (Detective Sean Duffy, #1)",Adrian McKinty,fiction,"mystery, thriller",4.1,320,2012,2023/06/10,"The Chain, The Outsider, Stephen King","Fast-paced mystery. If you like Stephen King, this hits the same notes.",No obvious red flags — depends on your mood.,
The Last Chance Lawyer (Daniel Pike #1),William Bernhardt,fiction,"legal, thriller, courtroom",4.2,482,2019,2023/05/31,"A Time to Kill, Presumed Innocent, John Grisham","Fast-paced thriller. If you like John Grisham, this hits the same notes.",No obvious red flags — depends on your mood.,
Bad Haircut: Stories from the Seventies,Tom Perrotta,fiction,"literary, coming-of-age",3.6,244,2012,2023/05/31,"Little Children, Tracy Flick Can't Win, John Green","Rich character work and atmospheric prose. If you like John Green, this hits the same notes.",Below-average community rating (3.6/5) — may underdeliver. Slow-burn pacing — not a fast thriller.,
Partners: A Rogue Lawyer Short Story (Kindle Single),John Grisham,fiction,"legal, thriller, courtroom",4,58,2016,2023/05/31,"The Firm, A Time to Kill, Scott Turow","Fast-paced thriller. If you like Scott Turow, this hits the same notes.",Short at 58 pages — may feel slight.,
The Mountain in the Sea,Ray Nayler,fiction,"sci-fi, speculative, literary",3.9,452,2023,2023/05/31,"Seveneves, Project Hail Mary, Neal Stephenson","Inventive speculative premise. If you like Neal Stephenson, this hits the same notes.",Slow-burn pacing — not a fast thriller. Character-driven literary fiction — light on plot momentum.,
"Not Forever, But For Now",Chuck Palahniuk,fiction,"literary, humor, speculative",3.4,256,2023,2023/05/27,"Raised in Captivity, I Wear the Black Hat, Chuck Klosterman","Inventive speculative premise. If you like Chuck Klosterman, this hits the same notes.",Below-average community rating (3.4/5) — may underdeliver. Slow-burn pacing — not a fast thriller.,
"Traffic: Genius, Rivalry, and Delusion in the Billion-Dollar Race to Go Viral",Ben Smith,nonfiction,"tech history, narrative nonfiction, business",3.8,352,2023,2023/05/27,"Super Pumped, Hatching Twitter, Mike Isaac","Narrative nonfiction — reads like a novel about tech history. If you like Mike Isaac, this hits the same notes.",Modest rating (3.8/5).,
The Battle for Your Brain: Defending the Right to Think Freely in the Age of Neurotechnology,Nita A. Farahany,nonfiction,"narrative nonfiction, tech history, psychology",3.8,288,2023,2023/05/22,"The Code Breaker, The Innovators, Walter Isaacson","Narrative nonfiction — reads like a novel about tech history. If you like Walter Isaacson, this hits the same notes.",Modest rating (3.8/5).,
"Rogue Justice (Avery Keene, #2)",Stacey Abrams,fiction,"legal, thriller, political",4,353,2023,2023/05/20,"A Time to Kill, The President Is Missing, John Grisham","Fast-paced thriller. If you like John Grisham, this hits the same notes.",No obvious red flags — depends on your mood.,
A Face in the Crowd / The Longest December,Stephen King,fiction,"thriller, speculative, literary",3.8,144,2023,2023/03/25,"The Outsider, Elevation, Blake Crouch","Atmospheric thriller. If you like Blake Crouch, this hits the same notes.",Modest rating (3.8/5). Slow-burn pacing — not a fast thriller.,
"There's Just One Problem...: True Tales from the Former, One-Time, 7th Most Powerful Person in WWE",Brian Gewirtz,nonfiction,"humor, memoir, narrative nonfiction",3.9,288,2022,2023/03/19,"Yearbook, A Life in Parts, Seth Rogen","Personal, candid memoir. If you like Seth Rogen, this hits the same notes.",May feel more informational than narrative if you prefer story-driven reads.,
The Presidents Club: Inside the World's Most Exclusive Fraternity,Nancy Gibbs,nonfiction,"history, biography, narrative nonfiction",4,641,2012,2023/02/14,"A Promised Land, The Accidental President, Barack Obama","In-depth biography. If you like Barack Obama, this hits the same notes.",Long commitment at 641 pages.,
"An Innocent Client (Joe Dillard, #1)",Scott Pratt,fiction,"legal, thriller, courtroom",4.3,375,2013,2023/02/03,"A Time to Kill, The Street Lawyer, John Grisham","Fast-paced thriller. If you like John Grisham, this hits the same notes.",No obvious red flags — depends on your mood.,
Ascension,Nicholas Binge,fiction,"sci-fi, speculative, thriller",3.7,344,2023,2023/01/17,"Recursion, Dark Matter, Blake Crouch","Atmospheric thriller. If you like Blake Crouch, this hits the same notes.",Modest rating (3.7/5).,
Snow Crash,Neal Stephenson,fiction,"sci-fi, speculative, dystopia",4,576,2022,2023/01/07,"Seveneves, Dark Matter, Blake Crouch","Inventive speculative premise. If you like Blake Crouch, this hits the same notes.",Slow-burn pacing — not a fast thriller. Dark or heavy subject matter.,
Wilt: Larger Than Life,Robert Cherry,nonfiction,"sports, biography, narrative nonfiction",4.1,384,2004,2022/12/16,"Dream Team, Three-Ring Circus, Jeff Pearlman","In-depth biography. If you like Jeff Pearlman, this hits the same notes.",May feel more informational than narrative if you prefer story-driven reads.,
Stolen Focus: Why You Can't Pay Attention— and How to Think Deeply Again,Johann Hari,nonfiction,"psychology, narrative nonfiction, tech history",3.8,357,2022,2022/12/03,"Maybe You Should Talk to Someone, The Innovators, Lori Gottlieb","Narrative nonfiction — reads like a novel about psychology. If you like Lori Gottlieb, this hits the same notes.",Modest rating (3.8/5).,
You Must Remember This,Kat Rosenfield,fiction,"thriller, psychological, mystery",3.8,320,2023,2022/11/04,"The Silent Patient, The Woman in the Window, Alex Michaelides","Tense thriller. If you like Alex Michaelides, this hits the same notes.",Modest rating (3.8/5). Dark or heavy subject matter.,
Butts: A Backstory,Heather Radke,nonfiction,"narrative nonfiction, history",3.7,311,2022,2022/10/29,"Sex, Drugs, and Cocoa Puffs, I Wear the Black Hat, Chuck Klosterman","Narrative nonfiction — reads like a novel about history. If you like Chuck Klosterman, this hits the same notes.",Modest rating (3.7/5).,
The Genome Defense: Inside the Epic Legal Battle to Determine Who Owns Your DNA,Jorge L. Contreras,nonfiction,"legal, narrative nonfiction, science, social commentary",3.9,432,2022,2022/10/14,"The Code Breaker, Presumed Innocent, Walter Isaacson","Narrative nonfiction — reads like a novel about legal. If you like Walter Isaacson, this hits the same notes.",May feel more informational than narrative if you prefer story-driven reads.,
The Book of Joe: Trying Not to Suck at Baseball and Life,Joe Maddon,nonfiction,"sports, memoir, narrative nonfiction",3.9,369,2022,2022/10/13,"The Cubs Way, Charlie Hustle, Tom Verducci","Personal, candid memoir. If you like Tom Verducci, this hits the same notes.",May feel more informational than narrative if you prefer story-driven reads.,
"Hello, Molly!: A Memoir",Molly Shannon,nonfiction,"humor, memoir, narrative nonfiction",4,291,2022,2022/09/13,"Yearbook, A Life in Parts, Seth Rogen","Personal, candid memoir. If you like Seth Rogen, this hits the same notes.",May feel more informational than narrative if you prefer story-driven reads.,
